ID,Intent,Question_EN,Answer_EN,Question_HA,Answer_HA,Keywords,Source
TAX_001,pit_rates,What is the income tax rate on salary in Nigeria?,Income tax uses a graduated system: 7% for N300k–N600k; 11% for N600k–N1.1m.,,,"PIT, salary, rate, graduated","Nigeria Tax Act 2025, Section 58"
TAX_002,pit_exempt,Who is exempt from paying personal income tax?,"Individuals earning below N300,000 per year are exempt from paying PIT.",,,"PIT, exempt, N300k, threshold","Nigeria Tax Act 2025, Sections 35–36"
TAX_003,paye,How is tax deducted from a resident individual's employment income?,It is typically deducted at source via the Pay As You Earn (PAYE) system by the employer.,,,"PAYE, employer, deduct, employment","Nigeria Tax Act 2025, Section 13"
TAX_004,benefits_in_kind,Are benefits-in-kind taxable for employees?,"Yes, benefits-in-kind are considered part of employment income and are subject to tax.",,,"benefits, in-kind, taxable, employment","Nigeria Tax Act 2025, Section 14"
TAX_005,presumptive_tax,What is presumptive taxation for individuals?,It is a simplified tax regime for individuals whose actual income cannot be easily determined.,,,"presumptive, simplified, income","Nigeria Tax Act 2025, Section 29"
TAX_006,company_income_tax,What is the standard rate of tax for companies?,"Companies are taxed based on size; small companies at 0%, others at 30%.",,,"CIT, company, 0%, 30%, rate","Nigeria Tax Act 2025, Section 56"
TAX_007,company_income_tax,How are the total profits of a company ascertained?,Total profits are determined by aggregating assessable profits from all sources for the year.,,,"CIT, profits, assessable, aggregate","Nigeria Tax Act 2025, Section 27"
TAX_008,specialised_tax,Are export processing and free trade zone entities taxable?,Such entities have specific exemptions and rules under the specialized trade provisions.,,,"free trade zone, export, exempt","Nigeria Tax Act 2025, Section 60"
TAX_009,specialised_tax,How is the lottery and gaming trade taxed?,These are categorised as specialized trades with specific assessment criteria under the Act.,,,"lottery, gaming, specialised, tax","Nigeria Tax Act 2025, Section 62"
TAX_010,capital_gains_tax,What is a 'chargeable gain' for tax purposes?,A gain that occurs upon the disposal of chargeable assets as defined by the Act.,,,"CGT, chargeable gain, disposal, assets","Nigeria Tax Act 2025, Section 33"
TAX_011,capital_gains_tax,Does compulsory acquisition of land trigger CGT?,Specific provisions apply to the disposal of land under compulsory acquisition.,,,"CGT, land, compulsory acquisition","Nigeria Tax Act 2025, Section 37"
TAX_012,petroleum_tax,What is the Hydrocarbon Tax?,A tax charged on profits from certain upstream petroleum operations in Nigeria.,,,"hydrocarbon, petroleum, upstream, tax","Nigeria Tax Act 2025, Section 66"
TAX_013,petroleum_tax,Are incentives available for the utilisation of associated gas?,"Yes, the Act provides specific incentives to encourage the utilisation of associated gas.",,,"gas, incentive, associated gas","Nigeria Tax Act 2025, Section 93"
TAX_014,value_added_tax,Are passenger road-transport services exempt from VAT?,Shared passenger road-transport services are generally exempt from VAT.,,,"VAT, transport, exempt, bus","Nigeria Tax Act 2025, Part IV"
TAX_015,value_added_tax,Is agricultural equipment subject to VAT?,Purchase or lease of tractors and equipment for agricultural purposes is exempt.,,,"VAT, agriculture, tractor, exempt","Nigeria Tax Act 2025, Part IV"
TAX_016,deductions,What expenses are allowed to be deducted from business profits?,Expenses must be wholly and exclusively incurred for the production of income to be deductible.,,,"deduction, allowable, business, expenses","Nigeria Tax Act 2025, Section 20"
TAX_017,deductions,Are penalties paid to the government tax-deductible?,"No, any expenditure incurred as a penalty (e.g., gas flare fees) is not a deductible expense.",,,"penalty, non-deductible, gas flare","Nigeria Tax Act 2025, Sections 21 & 100"
TAX_018,deductions,Can I deduct the cost of capital assets from my daily business income?,Capital expenditure is generally not allowed as a deduction; capital allowances are claimed instead.,,,"capital, allowance, deduction, asset","Nigeria Tax Act 2025, Section 21"
TAX_019,assessable_profits,What is the basis for computing assessable profits for a business?,Assessable profits are generally based on the profits of the accounting period preceding the year of assessment.,,,"assessable profits, accounting period, basis","Nigeria Tax Act 2025, Section 26"
TAX_020,assessable_profits,What happens to tax when a company permanently stops its trade?,Specific cessation rules apply for computing assessable profits in the year a business shuts down.,,,"cessation, trade, shutdown, assessable","Nigeria Tax Act 2025, Sections 22–26"
TAX_021,assessable_profits,How is tax calculated for a new business starting for the first time?,New businesses follow specific commencement rules to determine their assessable profits for their first few years.,,,"new business, commencement, first year","Nigeria Tax Act 2025, Sections 22–26"
TAX_022,development_levy,What is the Development Levy under the 2025 Act?,"It is a levy charged to support national infrastructure, security, and education funds.",,,"development levy, infrastructure, security","Nigeria Tax Act 2025, Section 59"
TAX_023,development_levy,How is the Development Levy money distributed?,"Split between Nigeria Police (15%), Nigerian Education Loan (15%), and other security/tech funds.",,,"development levy, police, education, distribution","Nigeria Tax Act 2025, Sections 59 & 14th Schedule"
TAX_024,development_levy,What is the Defence and Security Infrastructure Fund?,A fund established by the Act to implement national security schemes and develop the defence industry.,,,"defence fund, security, infrastructure","Nigeria Tax Act 2025, 14th Schedule"
TAX_025,value_added_tax,Is milk subject to VAT in Nigeria?,"No, milk (fresh or processed) is exempt from VAT.",,,"VAT, milk, exempt, food","Nigeria Tax Act 2025, Section 186 & Schedule"
TAX_026,value_added_tax,Are medical services for animals taxable?,Medical services for both humans and animals rendered by a qualified practitioner are VAT exempt.,,,"VAT, veterinary, medical, exempt","Nigeria Tax Act 2025, Section 186 & Schedule"
TAX_027,value_added_tax,Are farm tractors subject to VAT?,"The purchase, hire, or lease of tractors and agricultural equipment is VAT exempt.",,,"VAT, tractor, farm, exempt, agriculture","Nigeria Tax Act 2025, Part IV"
TAX_028,petroleum_tax,What is the basis period for income tax on petroleum operations?,The basis period is generally the accounting period of the company engaged in petroleum operations.,,,"petroleum, basis period, income tax","Nigeria Tax Act 2025, Section 90"
TAX_029,petroleum_tax,How is the 'Adjusted Profit' of a petroleum company calculated?,"It is the profit of the period after specific deductions allowed under the Act, such as those in Section 97.",,,"adjusted profit, petroleum, deductions","Nigeria Tax Act 2025, Section 96"
TAX_030,petroleum_tax,What defines 'Petroleum' under Chapter Three of the Act?,"It includes hydrocarbons in their natural state, such as crude oil, natural gas, and condensates.",,,"petroleum, definition, crude oil, gas","Nigeria Tax Act 2025, Section 117"
TAX_031,petroleum_tax,Are royalties for natural gas and gas liquids different from crude oil?,"Yes, the Act specifies that royalties for natural gas follow a distinct set of rules.",,,"royalty, gas, crude oil, liquids","Nigeria Tax Act 2025, First Schedule"
TAX_032,petroleum_tax,What happens if a company sells chargeable oil below the fiscal price?,Additional tax may be payable if the sale price is lower than the established fiscal oil price.,,,"fiscal price, chargeable oil, additional tax","Nigeria Tax Act 2025, Section 91"
TAX_033,psc_taxation,What is 'Cost Oil' in a Production Sharing Contract?,The portion of available crude oil used to reimburse the contractor for operating and capital costs.,,,"PSC, cost oil, contractor, recover","Nigeria Tax Act 2025, Section 117"
TAX_034,psc_taxation,How is 'Tax Oil' defined in the 2025 Act?,The portion of available crude oil used by the holder to settle the contractor's income tax liabilities.,,,"PSC, tax oil, contractor, liability","Nigeria Tax Act 2025, Section 117"
TAX_035,psc_taxation,Who determines quality and gravity differentials for Nigerian crude?,Differentials are based on the established fiscal oil price for Nigerian crude of comparable quality.,,,"crude, gravity, fiscal price, differentials","Nigeria Tax Act 2025, Section 91(2)"
TAX_036,administration,Can a tax officer act without the standard seven-day notice?,"Yes, an officer not below the rank of Chief Inspector may act without notice in specific urgent cases.",,,"tax officer, notice, 7 days, urgent","FIRS Tax Law Compendium, p.142"
TAX_037,administration,What is the minimum notice period for document requests from the tax service?,Generally at least seven days from the date of service.,,,"notice, 7 days, documents, FIRS","FIRS Tax Law Compendium, p.142"
TAX_038,administration,What is 'Qualifying Expenditure' for capital allowance purposes?,"Capital expenditure on assets like plant, machinery, or buildings used for business.",,,"qualifying expenditure, capital allowance, plant","FIRS Tax Law Compendium, Fourth Schedule"
TAX_039,administration,How is the 'Residue' of qualifying expenditure calculated?,It is the total expenditure minus the total allowances previously granted for that asset.,,,"residue, qualifying expenditure, allowance","FIRS Tax Law Compendium, Fourth Schedule"
TAX_040,administration,Does a new lease on the same asset count as separate expenditure?,"If a new lease is granted to the same lessee on termination, it is treated as a continuation of the first lease.",,,"lease, continuation, allowance, asset","FIRS Tax Law Compendium, Fourth Schedule"
TAX_041,stamp_duty,"Are electronic transfers below N10,000 subject to tax?","No, electronic transfers or receipts below N10,000 are exempt from duty.",,,"stamp duty, N10k, exempt, transfer","Nigeria Tax Act 2025, Section 185(i)"
TAX_042,stamp_duty,Is the transfer of shares in Nigerian companies exempt from stamp duty?,"Yes, all documents relating to transfer of stocks and shares are exempt from stamp duties.",,,"stamp duty, shares, exempt, stocks","Nigeria Tax Act 2025, Section 185(h)"
TAX_043,stamp_duty,Are salary payments exempt from the Electronic Money Transfer Levy?,"Yes, transfers made for salary payments are specifically exempt from the levy.",,,"EMTL, salary, exempt, transfer","Nigeria Tax Act 2025, Section 185(i)"
TAX_044,stamp_duty,Do intra-bank self-transfers attract electronic transfer charges?,"No, transfers between a person's own accounts within the same bank are exempt.",,,"intra-bank, self-transfer, exempt, EMTL","Nigeria Tax Act 2025, Section 185(i)"
TAX_045,stamp_duty,Are instruments executed by co-operative societies subject to stamp duty?,"No, any instrument executed by a registered co-operative society is exempt.",,,"co-operative, stamp duty, exempt","Nigeria Tax Act 2025, Section 185(e)"
TAX_046,capital_gains_tax,What is the new Capital Gains Tax (CGT) rate for companies?,The standard CGT rate for companies is aligned with CIT at 30% under the 2025 Act.,,,"CGT, companies, 30%, rate","Nigeria Tax Act 2025, Section 34"
TAX_047,capital_gains_tax,Are digital assets like cryptocurrencies subject to Capital Gains Tax?,"Yes, chargeable assets now explicitly include digital assets, cryptocurrencies, and digital tokens.",,,"CGT, crypto, digital assets, NFT","Nigeria Tax Act 2025, Section 34"
TAX_048,capital_gains_tax,When is the sale of shares in a Nigerian company exempt from CGT?,Exempt if proceeds are less than N150m and the chargeable gain does not exceed N10m in 12 months.,,,"CGT, shares, exempt, N150m, N10m","Nigeria Tax Act 2025, Section 34"
TAX_049,capital_gains_tax,Are gains from government bonds taxable?,"No, income generated from government bonds is listed as exempt income.",,,"CGT, bonds, government, exempt","Nigeria Tax Act 2025, Section 121"
TAX_050,administration,What is the 'Electronic Fiscal System' (EFS)?,A digital system mandated for recording and reporting all taxable supplies to ensure accuracy.,,,"EFS, electronic, fiscal, digital, system","Nigeria Tax Administration Act 2025, Section 23"
TAX_051,administration,When must a business file its monthly return for chargeable services?,Returns must generally be submitted by the 21st day of the following month.,,,"monthly return, 21st day, filing","Nigeria Tax Administration Act 2025, Section 24"
TAX_052,administration,What is the deadline for reporting foreign exchange transactions?,Foreign exchange transactions must be reported within seven days.,,,"forex, FX, 7 days, report","Nigeria Tax Administration Act 2025, Section 24"
TAX_053,presumptive_tax,What is 'Presumptive Tax' under the new law?,A simplified tax assessment used when a taxpayer's actual income cannot be determined due to lack of records.,,,"presumptive tax, records, simplified","Nigeria Tax Act 2025, Section 29"
TAX_054,administration,Who is the 'Tax Ombud' established by the 2025 reforms?,The Tax Ombud is an office created to handle and resolve taxpayer grievances and disputes.,,,"tax ombud, grievances, disputes, taxpayer",Joint Revenue Board Act 2025
TAX_055,value_added_tax,What is the difference between VAT 'Exempt' and 'Zero-Rated' (0%) supplies?,Exempt means no VAT charged and no input tax can be claimed. Zero-rated means 0% charged but input tax can be claimed.,,,"VAT, exempt, zero-rated, input tax, difference","Nigeria Tax Act 2025, Sections 186–187"
TAX_056,value_added_tax,Are basic food items like bread and rice subject to VAT?,"No, basic food items (bread, cereals, vegetables) are Zero-Rated (0%) to keep them affordable.",,,"VAT, food, bread, rice, zero-rated, exempt","Nigeria Tax Act 2025, Section 187"
TAX_057,value_added_tax,Does a student pay VAT on school fees (tuition)?,"No, tuition for nursery, primary, secondary, and tertiary education is Zero-Rated (0%).",,,"VAT, school fees, tuition, education, zero-rated","Nigeria Tax Act 2025, Section 187"
TAX_058,value_added_tax,Is electricity supply subject to VAT?,Electricity across the entire value chain (generation to consumer) is now Zero-Rated (0%).,,,"VAT, electricity, zero-rated, DISCO, GENCO","Nigeria Tax Act 2025, Section 187"
TAX_059,value_added_tax,Do I pay VAT on medical services or medicines?,Medical services and pharmaceutical products are Zero-Rated (0%); cosmetology is excluded.,,,"VAT, medical, medicine, pharmaceutical, zero-rated","Nigeria Tax Act 2025, Section 187"
TAX_060,value_added_tax,Are baby products like diapers and milk taxed?,"No, baby products for children aged 0–3 years are VAT Exempt under the 2025 Act.",,,"VAT, baby, diapers, exempt, children","Nigeria Tax Act 2025, Section 186"
TAX_061,value_added_tax,What is the VAT treatment for public transport?,Shared passenger road transport is VAT Exempt; ride-hailing (Uber/Bolt) is not exempt.,,,"VAT, transport, danfo, keke, exempt, uber","Nigeria Tax Act 2025, Section 186"
TAX_062,value_added_tax,Do exporters pay VAT on goods sent out of Nigeria?,Exported goods and services (except oil and gas) are Zero-Rated (0%) to encourage exports.,,,"VAT, export, zero-rated, goods, international","Nigeria Tax Act 2025, Section 187"
TAX_063,development_levy,What is the 'Development Levy' introduced in 2025?,"A single 4% levy on the assessable profits of medium and large companies, replacing several old taxes.",,,"development levy, 4%, TET, police levy","Nigeria Tax Act 2025, Section 59"
TAX_064,development_levy,Do small businesses pay the 4% Development Levy?,"No, small companies (turnover ≤N100m and fixed assets ≤N250m) are exempt.",,,"development levy, small business, exempt","Nigeria Tax Act 2025, Section 59"
TAX_065,excise_duty,Are digital products or electronic goods subject to excise duty?,"Yes, the 2025 Act expands excise duties to cover certain digital products and locally manufactured electronics.",,,"excise, digital, electronics, duty","Nigeria Tax Act 2025, Section 195"
TAX_066,customs_duty,Who is responsible for collecting Customs and Excise duties?,The Nigeria Customs Service (NCS) remains the sole authority for assessing and collecting these duties.,,,"customs, NCS, excise, collection","Nigeria Tax Act 2025, Chapter 7"
TAX_067,customs_duty,What is the penalty for making a false declaration to Customs?,"A false declaration can lead to a N5 million fine or imprisonment, plus seizure of the goods.",,,"customs, false declaration, penalty, N5m","Nigeria Tax Act 2025, Chapter 7"
TAX_068,value_added_tax,What is 'VAT Fiscalisation'?,A mandatory digital system where businesses must report every taxable sale to the tax authority in real-time.,,,"VAT, fiscalisation, digital, real-time, EFS","Nigeria Tax Act 2025, Section 158"
TAX_069,excise_duty,Is there a tax on fossil fuels in the 2025 Act?,"Yes, a 5% Fossil Fuel Surcharge; excludes household kerosene, LPG (cooking gas), and CNG.",,,"fossil fuel, surcharge, 5%, kerosene, LPG, CNG","Nigeria Tax Act 2025, Chapter 7"
TAX_070,withholding_tax,What is Withholding Tax (WHT) in Nigeria?,"WHT is an advance payment of income tax, deducted at the source of a transaction and remitted to FIRS.",,,"WHT, withholding tax, advance, source, FIRS","Nigeria Tax Act 2025, Section 92"
TAX_071,withholding_tax,What is the WHT rate for consultancy or professional services?,5% for individuals and 10% for corporate entities.,,,"WHT, consultancy, professional, 5%, 10%","Nigeria Tax Act 2025, Section 94"
TAX_072,withholding_tax,Does Withholding Tax apply to dividends?,"Yes, dividends are subject to WHT at 10%; may vary for non-residents under tax treaties.",,,"WHT, dividend, 10%, non-resident, treaty","Nigeria Tax Act 2025, Section 95"
TAX_073,withholding_tax,Is WHT a final tax for everyone?,"No, WHT is usually a credit against the total tax liability at year-end, except for certain income types.",,,"WHT, final tax, credit, annual","Nigeria Tax Act 2025, Section 96"
TAX_074,withholding_tax,What is a 'WHT Credit Note'?,A document proving that tax was deducted from your payment; used to reduce your total annual tax bill.,,,"WHT, credit note, FIRS, reduce tax","Nigeria Tax Act 2025, Section 98"
TAX_075,stamp_duty,What is Stamp Duty?,"Tax on written or electronic instruments (documents) such as agreements, contracts, and receipts.",,,"stamp duty, document, agreement, contract","Nigeria Tax Act 2025, Section 102"
TAX_076,stamp_duty,Does every bank transfer attract the Electronic Money Transfer Levy?,"The EMT Levy of N50 applies to electronic transfers of N10,000 or more into a bank account.",,,"EMTL, bank transfer, N50, N10k","Nigeria Tax Act 2025, Section 105"
TAX_077,stamp_duty,Are rent agreements subject to Stamp Duty?,"Yes, lease and tenancy agreements must be stamped at rates based on the duration of the lease.",,,"stamp duty, rent, lease, agreement","Nigeria Tax Act 2025, Section 108"
TAX_078,withholding_tax,What is the penalty for failing to deduct Withholding Tax?,"Penalty of 10% of the amount not deducted, plus interest at the prevailing CBN rate.",,,"WHT, penalty, 10%, CBN rate","Nigeria Tax Act 2025, Section 100"
TAX_079,withholding_tax,When must WHT be remitted to the FIRS?,WHT must be remitted within 30 days of the date the amount was deducted.,,,"WHT, remit, 30 days, FIRS, deadline","Nigeria Tax Act 2025, Section 101"
TAX_080,stamp_duty,Do I need to pay Stamp Duty on a gift of land?,"Yes, instruments conveying property as a gift are subject to stamp duty based on property value.",,,"stamp duty, gift, land, property","Nigeria Tax Act 2025, Section 110"
TAX_081,withholding_tax,Is there WHT on interest earned from savings?,"Yes, interest earned is generally subject to WHT at 10%, deducted by the bank.",,,"WHT, savings, interest, 10%, bank","Nigeria Tax Act 2025, Section 95"
TAX_082,stamp_duty,What happens if a document is not stamped?,Unstamped documents may not be admissible as evidence in court for civil proceedings.,,,"stamp duty, unstamped, court, inadmissible","Nigeria Tax Act 2025, Section 115"
TAX_083,withholding_tax,Are small businesses exempt from deducting WHT?,Small businesses with turnover below the VAT threshold are often exempt from acting as WHT agents.,,,"WHT, small business, exempt, agent","Nigeria Tax Act 2025, Section 93"
TAX_084,stamp_duty,Who pays the Stamp Duty on a contract between two parties?,"Unless agreed otherwise, the person receiving the document or beneficiary of the contract usually pays.",,,"stamp duty, who pays, contract, beneficiary","Nigeria Tax Act 2025, Section 112"
TAX_085,company_income_tax,How are companies classified for tax under the 2025 Act?,"Small (turnover ≤N50m), Medium (>N50m to N100m), and Large (>N100m).",,,"CIT, company, small, medium, large, turnover","Nigeria Tax Act 2025, Section 56"
TAX_086,company_income_tax,What is the CIT rate for a Small Company?,"Small companies (turnover ≤N50m) are subject to 0% CIT, provided not in professional services.",,,"CIT, small company, 0%, exempt","Nigeria Tax Act 2025, Section 56"
TAX_087,company_income_tax,What is the CIT rate for a Medium Company?,Medium companies with turnover N50m–N100m are taxed at 20%.,,,"CIT, medium company, 20%, turnover","Nigeria Tax Act 2025, Section 56"
TAX_088,company_income_tax,What is the CIT rate for a Large Company?,Large companies with turnover exceeding N100m are taxed at 30%.,,,"CIT, large company, 30%, turnover","Nigeria Tax Act 2025, Section 56"
TAX_089,company_income_tax,Do small companies still need to file tax returns?,"Yes, all companies must file annual tax returns regardless of tax size exemption.",,,"CIT, small company, file, returns, mandatory","Nigeria Tax Act 2025, Section 120"
TAX_090,company_income_tax,What is the new Development Levy?,"A consolidated 4% levy on assessable profits of medium and large companies, replacing Education Tax.",,,"development levy, 4%, TET, education tax","Nigeria Tax Act 2025, Section 59"
TAX_091,company_income_tax,Are small companies required to pay the 4% Development Levy?,"No, small companies (turnover ≤N50m) are exempt from the 4% Development Levy.",,,"development levy, small company, exempt","Nigeria Tax Act 2025, Section 59"
TAX_092,company_income_tax,What is the 'Minimum Tax' for companies?,"Companies with no profit pay a minimum tax of 0.5% of gross turnover, unless in first 4 years.",,,"minimum tax, 0.5%, turnover, company","Nigeria Tax Act 2025, Section 65"
TAX_093,company_income_tax,Which companies are exempt from Minimum Tax?,"Small companies, those in their first four years, and primary agricultural businesses are exempt.",,,"minimum tax, exempt, agriculture, first 4 years","Nigeria Tax Act 2025, Section 65"
TAX_094,company_income_tax,What is the deadline for filing CIT returns?,Returns must be filed within 6 months after the end of the company's accounting year.,,,"CIT, filing, deadline, 6 months","Nigeria Tax Act 2025, Section 121"
TAX_095,company_income_tax,Can a company claim 'Capital Allowance' on all assets?,"Yes, but you must provide proof of VAT payment or import duties to claim allowances on qualifying assets.",,,"capital allowance, VAT proof, qualifying assets","Nigeria Tax Act 2025, Section 22"
TAX_096,company_income_tax,What is the tax rate for 'Professional Service' companies?,"Professional service companies (law, accounting) are taxed at 30% regardless of turnover.",,,"CIT, professional services, 30%, law, accounting","Nigeria Tax Act 2025, Section 56"
TAX_097,company_income_tax,How is 'Agricultural Business' taxed?,Primary agricultural businesses enjoy a 5-year tax-free period from the date they commence operations.,,,"agriculture, 5-year, tax-free, pioneer","Nigeria Tax Act 2025, Section 62"
TAX_098,company_income_tax,What is the penalty for late filing of CIT?,"Penalty is N50,000 for the first month of default and N25,000 for every subsequent month.",,,"CIT, late filing, penalty, N50k, N25k","Nigeria Tax Act 2025, Section 125"
TAX_099,company_income_tax,What is the 'Effective Tax Rate' for MNEs?,Large MNEs with global turnover above €750m are subject to a 15% global minimum tax.,,,"MNE, ETR, 15%, global minimum tax, multinational","Nigeria Tax Act 2025, Section 57"
TAX_100,company_income_tax,Are dividends received by a company taxable?,Dividends received from a Nigerian company are 'franked investment income' and not subject to further CIT.,,,"dividend, franked investment, CIT, exempt","Nigeria Tax Act 2025, Section 80"
TAX_101,petroleum_tax,How is the 'Hydrocarbon Tax' calculated for upstream companies?,Hydrocarbon Tax is levied on profits from crude oil at 30% for onshore/shallow water and 15% for PPLs.,,,"hydrocarbon tax, 30%, 15%, onshore, shallow water","Nigeria Tax Act 2025, Section 72"
TAX_102,petroleum_tax,What is the total tax rate for deep offshore oil operations?,Deep offshore operations are exempt from Hydrocarbon Tax but subject to 30% CIT.,,,"petroleum, deep offshore, CIT, 30%","Nigeria Tax Act 2025, Section 73"
TAX_103,petroleum_tax,Can petroleum companies deduct 'Decommissioning' costs?,"Yes, contributions to a decommissioning fund are tax-deductible if backed by a certificate from the Commission.",,,"decommissioning, petroleum, deductible, fund","Nigeria Tax Act 2025, Section 75"
TAX_104,withholding_tax,What is the new Withholding Tax (WHT) rate for residents?,The WHT rate is generally 5% for most services provided by companies and individuals.,,,"WHT, resident, 5%, services","Nigeria Tax Act 2025, Section 82"
TAX_105,withholding_tax,Is WHT a final tax for small businesses?,"For certain small-scale suppliers, the WHT deducted at source may be treated as their final tax liability.",,,"WHT, final tax, small business","Nigeria Tax Act 2025, Section 83"
