ID,Intent,Question_EN,Answer_EN,Question_HA,Answer_HA,Keywords,Source
TAX_667,exemptions,Are there ways to lower my tax?,"Yes: maximize pension (8% of basic), pay NHF (2.5%), enrol in NHIS, take life insurance, claim rent relief (20% of rent, max N500k), and ensure all allowable business deductions are claimed.",,,"exempt, relief, pension, minimum wage, NGO, deduction, N800k","Nigeria Tax Act 2025, Section 162 & Fifth Schedule"
TAX_668,mixed_real_life,I just got a job do I need to pay tax now?,Yes. Provide your TIN to your employer immediately. Your employer will deduct PAYE from your first salary and remit to your State IRS. You should also file a personal return by March 31st.,,,"compliance, first time, new, voluntary disclosure, payment plan, TIN",Nigeria Tax Act 2025 — General Compliance Framework
TAX_669,mixed_real_life,I just started business what tax applies to me?,"Register for TIN, register with State IRS (sole trader) or FIRS (company), keep income and expense records, file annual return by March 31st, and register for VAT if turnover will exceed N25m.",,,"compliance, first time, new, voluntary disclosure, payment plan, TIN",Nigeria Tax Act 2025 — General Compliance Framework
TAX_670,mixed_real_life,I have never paid tax before what should I do?,Approach your State IRS or FIRS proactively for voluntary disclosure. Declare outstanding liabilities and negotiate a payment plan. Penalties may be reduced for genuine voluntary compliance.,,,"compliance, first time, new, voluntary disclosure, payment plan, TIN",Nigeria Tax Act 2025 — General Compliance Framework
TAX_671,mixed_real_life,Can I fix my tax problems now?,"Yes. Voluntary disclosure is the best approach. Contact your tax authority, disclose all outstanding liabilities, and arrange a structured payment plan. The earlier you act, the lower the penalties.",,,"compliance, first time, new, voluntary disclosure, payment plan, TIN",Nigeria Tax Act 2025 — General Compliance Framework
TAX_672,mixed_real_life,I think I have tax issues what next?,"Engage a qualified tax professional. Review all your filing history, quantify outstanding liabilities, and approach the tax authority for voluntary disclosure and a structured resolution.",,,"compliance, first time, new, voluntary disclosure, payment plan, TIN",Nigeria Tax Act 2025 — General Compliance Framework
TAX_673,mixed_real_life,Can I clear my tax debt gradually?,Yes. Apply to FIRS or your State IRS for an instalment payment arrangement. Submit a payment schedule with proof of financial capacity. Approval allows you to pay in monthly tranches.,,,"compliance, first time, new, voluntary disclosure, payment plan, TIN",Nigeria Tax Act 2025 — General Compliance Framework
TAX_674,mixed_real_life,I forgot to pay tax last year what happens?,File the outstanding return immediately and pay the tax owed. A late filing penalty will apply but proactive compliance reduces the risk of prosecution and further enforcement actions.,,,"compliance, first time, new, voluntary disclosure, payment plan, TIN",Nigeria Tax Act 2025 — General Compliance Framework
TAX_675,mixed_real_life,Is it too late to start paying tax?,It is never too late. Voluntary disclosure reduces penalties. The tax authority generally prefers taxpayers who come forward voluntarily over those who are caught through enforcement.,,,"compliance, first time, new, voluntary disclosure, payment plan, TIN",Nigeria Tax Act 2025 — General Compliance Framework
TAX_676,mixed_real_life,Can I start fresh with my taxes?,"Yes. Approach your State IRS or FIRS, disclose previous non-compliance, pay outstanding taxes (possibly with reduced penalties), and commit to full compliance going forward.",,,"compliance, first time, new, voluntary disclosure, payment plan, TIN",Nigeria Tax Act 2025 — General Compliance Framework
TAX_677,mixed_real_life,How do I become fully compliant?,Steps: 1. Register for TIN. 2. File all outstanding returns. 3. Pay all assessed taxes (instalment if needed). 4. Set up a system for ongoing record-keeping. 5. File and pay on time every year.,,,"compliance, first time, new, voluntary disclosure, payment plan, TIN",Nigeria Tax Act 2025 — General Compliance Framework
TAX_678,tax_general,What is the legal definition of taxation under Nigerian law?,"Under the Nigeria Tax Act 2025, taxation is a mandatory fiscal obligation imposed on taxable persons — individuals, companies, trusts, and estates — on income, transactions, or instruments.",,,"tax, Nigeria, FIRS, NRS, law, 2025, NTA",Nigeria Tax Act 2025 — General Provisions
TAX_679,tax_general,What are the objectives of taxation in Nigeria?,"The objectives include revenue generation for government, redistribution of wealth, economic regulation, discouraging harmful consumption, and attracting investment through incentives.",,,"tax, Nigeria, FIRS, NRS, law, 2025, NTA",Nigeria Tax Act 2025 — General Provisions
TAX_680,tax_general,Which authority is responsible for tax administration in Nigeria?,The Nigeria Revenue Service (formerly FIRS) administers federal taxes. The Joint Revenue Board coordinates state and federal tax administration to prevent double taxation.,,,"tax, Nigeria, FIRS, NRS, law, 2025, NTA",Nigeria Tax Act 2025 — General Provisions
TAX_681,tax_general,What are the major categories of taxes recognized in Nigeria?,"Major categories are: Income Taxes (PIT, CIT), Consumption Taxes (VAT, Excise), Transaction Taxes (Stamp Duty, Capital Gains), Sector-specific Taxes (Petroleum Profit Tax), and the Development Levy.",,,"tax, Nigeria, FIRS, NRS, law, 2025, NTA",Nigeria Tax Act 2025 — General Provisions
TAX_682,tax_general,What recent reforms have been introduced in the Nigerian tax system?,"The 2025 reforms consolidated 10 tax laws, introduced 0% CIT for small companies, global minimum tax (15% ETR) for MNEs, rent relief, digital tax rules, and abolished Education Tax replacing it with Development Levy.",,,"tax, Nigeria, FIRS, NRS, law, 2025, NTA",Nigeria Tax Act 2025 — General Provisions
TAX_683,tax_general,How is tax policy formulated in Nigeria?,"Tax is a compulsory financial contribution imposed by law on individuals and companies to fund government services such as roads, schools, hospitals, and security.",,,"tax, Nigeria, FIRS, NRS, law, 2025, NTA",Nigeria Tax Act 2025 — General Provisions
TAX_684,tax_general,What is the scope of Nigerian tax jurisdiction?,"Tax is a compulsory financial contribution imposed by law on individuals and companies to fund government services such as roads, schools, hospitals, and security.",,,"tax, Nigeria, FIRS, NRS, law, 2025, NTA",Nigeria Tax Act 2025 — General Provisions
TAX_685,tax_general,What laws govern taxation in Nigeria?,"The Nigeria Tax Act 2025 is the primary legislation, supported by the Nigeria Tax Administration Act 2025 and the Nigeria Revenue Service Establishment Act 2025.",,,"tax, Nigeria, FIRS, NRS, law, 2025, NTA",Nigeria Tax Act 2025 — General Provisions
TAX_686,tax_general,What is the role of the Federal Inland Revenue Service?,"The FIRS (now NRS) assesses, collects, and accounts for federal taxes including CIT, VAT, WHT, Petroleum Profits Tax, and the Development Levy; and enforces compliance nationally.",,,"tax, Nigeria, FIRS, NRS, law, 2025, NTA",Nigeria Tax Act 2025 — General Provisions
TAX_687,tax_general,How does taxation contribute to national development?,"Tax revenue funds capital expenditure (roads, hospitals, schools), pays government salaries, services national debt, and enables social programmes that reduce poverty and drive economic growth.",,,"tax, Nigeria, FIRS, NRS, law, 2025, NTA",Nigeria Tax Act 2025 — General Provisions
TAX_688,tin_registration,What is the procedure for obtaining a Tax Identification Number?,A Tax Identification Number (TIN) is a unique number assigned to every taxpayer by the Nigeria Revenue Service (NRS) for tax identification and compliance purposes.,,,"TIN, Tax ID, register, FIRS, NIN, JTB, online","Nigeria Tax Administration Act 2025, Sections 8–10"
TAX_689,tin_registration,What statutory requirements must be met for TIN registration?,A Tax Identification Number (TIN) is a unique number assigned to every taxpayer by the Nigeria Revenue Service (NRS) for tax identification and compliance purposes.,,,"TIN, Tax ID, register, FIRS, NIN, JTB, online","Nigeria Tax Administration Act 2025, Sections 8–10"
TAX_690,tin_registration,Is TIN registration mandatory for all taxable persons?,A Tax Identification Number (TIN) is a unique number assigned to every taxpayer by the Nigeria Revenue Service (NRS) for tax identification and compliance purposes.,,,"TIN, Tax ID, register, FIRS, NIN, JTB, online","Nigeria Tax Administration Act 2025, Sections 8–10"
TAX_691,tin_registration,Which agency issues the Tax Identification Number in Nigeria?,The Joint Tax Board (JTB) and the Nigeria Revenue Service (NRS/FIRS) jointly issue TINs through the unified TIN registration portal at tin.jtb.gov.ng.,,,"TIN, Tax ID, register, FIRS, NIN, JTB, online","Nigeria Tax Administration Act 2025, Sections 8–10"
TAX_692,tin_registration,What documentation is required for TIN registration?,A Tax Identification Number (TIN) is a unique number assigned to every taxpayer by the Nigeria Revenue Service (NRS) for tax identification and compliance purposes.,,,"TIN, Tax ID, register, FIRS, NIN, JTB, online","Nigeria Tax Administration Act 2025, Sections 8–10"
TAX_693,tin_registration,What is the legal implication of failing to obtain a TIN?,"Under the NTA 2025, failure to obtain a TIN attracts a N50,000 penalty for the first month and N25,000 per subsequent month. Banks can also decline services without TIN.",,,"TIN, Tax ID, register, FIRS, NIN, JTB, online","Nigeria Tax Administration Act 2025, Sections 8–10"
TAX_694,tin_registration,Can a taxpayer possess multiple TINs under Nigerian law?,No. Nigerian law prohibits holding multiple TINs. A taxpayer found with duplicate TINs is liable to penalties and administrative sanctions under the NTA 2025.,,,"TIN, Tax ID, register, FIRS, NIN, JTB, online","Nigeria Tax Administration Act 2025, Sections 8–10"
TAX_695,tin_registration,How can a taxpayer verify the authenticity of a TIN?,"TIN authenticity can be verified at tin.jtb.gov.ng using the TIN number, NIN, or registered phone number. FIRS offices also offer in-person verification.",,,"TIN, Tax ID, register, FIRS, NIN, JTB, online","Nigeria Tax Administration Act 2025, Sections 8–10"
TAX_696,tin_registration,What is the process for updating TIN information?,A Tax Identification Number (TIN) is a unique number assigned to every taxpayer by the Nigeria Revenue Service (NRS) for tax identification and compliance purposes.,,,"TIN, Tax ID, register, FIRS, NIN, JTB, online","Nigeria Tax Administration Act 2025, Sections 8–10"
TAX_697,tin_registration,Is TIN registration available through electronic platforms?,A Tax Identification Number (TIN) is a unique number assigned to every taxpayer by the Nigeria Revenue Service (NRS) for tax identification and compliance purposes.,,,"TIN, Tax ID, register, FIRS, NIN, JTB, online","Nigeria Tax Administration Act 2025, Sections 8–10"
TAX_698,paye,What is the Pay-As-You-Earn system under Nigerian tax law?,PAYE is a statutory tax deduction system under the NTA 2025 whereby employers deduct income tax from employees' gross emoluments monthly and remit to the employee's State IRS.,,,"PAYE, salary, employer, deduction, State IRS, monthly, remit","Nigeria Tax Act 2025, Section 13; PAYE Regulations 2025"
TAX_699,paye,How is PAYE administered within the Nigerian tax framework?,PAYE (Pay As You Earn) is a tax deduction system where employers deduct income tax from employees' salaries monthly and remit it directly to the relevant State Internal Revenue Service.,,,"PAYE, salary, employer, deduction, State IRS, monthly, remit","Nigeria Tax Act 2025, Section 13; PAYE Regulations 2025"
TAX_700,paye,Who bears the responsibility for PAYE remittance?,The employer bears full legal responsibility for deducting and remitting PAYE. Failure attracts a 10% penalty plus CBN interest on the unremitted amount.,,,"PAYE, salary, employer, deduction, State IRS, monthly, remit","Nigeria Tax Act 2025, Section 13; PAYE Regulations 2025"
TAX_701,paye,What statutory deductions are included in PAYE calculations?,"Statutory deductions include: Pension (8% of basic salary), NHF (2.5% of basic salary), NHIS contributions, and life insurance premiums. These reduce the chargeable income before PAYE is applied.",,,"PAYE, salary, employer, deduction, State IRS, monthly, remit","Nigeria Tax Act 2025, Section 13; PAYE Regulations 2025"
TAX_702,paye,How is PAYE liability computed for employees?,Annual Gross Income minus statutory deductions (Pension + NHF + NHIS + life insurance + rent relief) = Chargeable Income. Apply progressive tax bands. Divide annual tax by 12 for monthly PAYE.,,,"PAYE, salary, employer, deduction, State IRS, monthly, remit","Nigeria Tax Act 2025, Section 13; PAYE Regulations 2025"
TAX_703,paye,What are the employer's obligations under the PAYE system?,"Employers must: register with State IRS, deduct PAYE monthly, remit by the 10th of the following month, file monthly returns, issue annual tax deduction certificates, and maintain PAYE records for 6 years.",,,"PAYE, salary, employer, deduction, State IRS, monthly, remit","Nigeria Tax Act 2025, Section 13; PAYE Regulations 2025"
TAX_704,paye,What penalties apply for failure to remit PAYE?,Employers who fail to remit PAYE face a penalty of 10% of the unremitted amount plus interest at the prevailing CBN Monetary Policy Rate per annum under the NTA 2025.,,,"PAYE, salary, employer, deduction, State IRS, monthly, remit","Nigeria Tax Act 2025, Section 13; PAYE Regulations 2025"
TAX_705,paye,How can employees verify PAYE deductions?,"Check payslips monthly, request annual employer certificate of deduction, verify through your State IRS portal using TIN, or engage a tax professional to review your PAYE records.",,,"PAYE, salary, employer, deduction, State IRS, monthly, remit","Nigeria Tax Act 2025, Section 13; PAYE Regulations 2025"
TAX_706,paye,Is PAYE applicable to all categories of employees?,PAYE (Pay As You Earn) is a tax deduction system where employers deduct income tax from employees' salaries monthly and remit it directly to the relevant State Internal Revenue Service.,,,"PAYE, salary, employer, deduction, State IRS, monthly, remit","Nigeria Tax Act 2025, Section 13; PAYE Regulations 2025"
TAX_707,paye,What regulatory body oversees PAYE compliance?,"State Internal Revenue Services (e.g., KIRS, LIRS, BIRS) oversee PAYE compliance for employees. The Joint Tax Board coordinates between federal and state tax authorities.",,,"PAYE, salary, employer, deduction, State IRS, monthly, remit","Nigeria Tax Act 2025, Section 13; PAYE Regulations 2025"
TAX_708,personal_income_tax,What constitutes taxable income under the Personal Income Tax Act?,"Taxable income includes all income accruing to a resident individual: employment income, business profits, investment income (dividends, interest, royalties), rental income, capital gains, and digital income.",,,"PIT, income, salary, individual, tax bands, N800k, progressive","Nigeria Tax Act 2025, Sections 12–31 & Fourth Schedule"
TAX_709,personal_income_tax,Who qualifies as a taxable individual in Nigeria?,"Any individual resident in Nigeria (domiciled, permanent home, or present 183+ days) who earns income above the minimum wage threshold is a taxable individual under the NTA 2025.",,,"PIT, income, salary, individual, tax bands, N800k, progressive","Nigeria Tax Act 2025, Sections 12–31 & Fourth Schedule"
TAX_710,personal_income_tax,How is personal income tax liability determined?,PIT liability = (Gross Income minus allowable deductions) multiplied by applicable progressive tax rates. The resulting annual tax is divided by 12 for monthly PAYE deductions.,,,"PIT, income, salary, individual, tax bands, N800k, progressive","Nigeria Tax Act 2025, Sections 12–31 & Fourth Schedule"
TAX_711,personal_income_tax,What deductions are allowable under Nigerian tax law?,"Allowable deductions include: pension contributions (8% of basic salary), NHF (2.5%), NHIS, life insurance premiums, and rent relief (20% of rent paid, maximum N500,000).",,,"PIT, income, salary, individual, tax bands, N800k, progressive","Nigeria Tax Act 2025, Sections 12–31 & Fourth Schedule"
TAX_712,personal_income_tax,What income streams are exempt from taxation?,"Exempt streams: minimum wage earnings, approved pension income, military salary, government bond interest, disability compensation (up to N50m), foreign dividends/rent via approved banking channels.",,,"PIT, income, salary, individual, tax bands, N800k, progressive","Nigeria Tax Act 2025, Sections 12–31 & Fourth Schedule"
TAX_713,personal_income_tax,How are allowances treated for tax purposes?,"Most employment allowances are included in gross income for PAYE calculation. Benefits-in-kind are valued and added to taxable income. Only specific employer-provided items (uniforms, tools) are excluded.",,,"PIT, income, salary, individual, tax bands, N800k, progressive","Nigeria Tax Act 2025, Sections 12–31 & Fourth Schedule"
TAX_714,personal_income_tax,What is the applicable tax rate for individuals?,"Progressive rates apply: 0% on first N800,000; 15% on N800k-N3m; 18% on N3m-N12m; 21% on N12m-N25m; 23% on N25m-N50m; 25% on amounts exceeding N50m per annum.",,,"PIT, income, salary, individual, tax bands, N800k, progressive","Nigeria Tax Act 2025, Sections 12–31 & Fourth Schedule"
TAX_715,personal_income_tax,Are self-employed individuals subject to income tax?,Yes. Self-employed individuals pay PIT through Direct Assessment with their State IRS. They must file annual returns by March 31st and pay tax on net business profits.,,,"PIT, income, salary, individual, tax bands, N800k, progressive","Nigeria Tax Act 2025, Sections 12–31 & Fourth Schedule"
TAX_716,personal_income_tax,How is residency determined for tax purposes?,"A person is a tax resident in Nigeria if they are domiciled there, have a permanent home available, sojourn for 183+ days in a 12-month period, or serve as a Nigerian diplomatic officer abroad.",,,"PIT, income, salary, individual, tax bands, N800k, progressive","Nigeria Tax Act 2025, Sections 12–31 & Fourth Schedule"
TAX_717,personal_income_tax,What provisions govern income earned from multiple sources?,"Under NTA 2025, all income from multiple sources is aggregated and taxed jointly as total income. The progressive tax bands apply to the combined chargeable income from all sources.",,,"PIT, income, salary, individual, tax bands, N800k, progressive","Nigeria Tax Act 2025, Sections 12–31 & Fourth Schedule"
TAX_718,filing,What is the statutory requirement for filing tax returns?,"Under the NTA 2025, every taxable person must file an annual return of total income from all sources, whether or not tax is payable, by March 31st (individuals) or within 6 months (companies).",,,"filing, return, deadline, March 31, e-filing, annual, online","Nigeria Tax Administration Act 2025, Sections 24–30"
TAX_719,filing,When is the deadline for submission of tax returns?,Individuals: March 31st annually. Companies: within 6 months after the financial year-end. VAT: 21st of each following month. WHT: 21st of each following month.,,,"filing, return, deadline, March 31, e-filing, annual, online","Nigeria Tax Administration Act 2025, Sections 24–30"
TAX_720,filing,What are the consequences of late filing?,"Late filing penalties: N50,000 for the first month and N25,000 for each subsequent month. Interest accrues on any outstanding tax liability at the CBN Monetary Policy Rate.",,,"filing, return, deadline, March 31, e-filing, annual, online","Nigeria Tax Administration Act 2025, Sections 24–30"
TAX_721,filing,What procedures are involved in filing tax returns?,Tax returns must be filed annually. Individuals file by March 31st; companies file within 6 months after their financial year end. Returns can be filed online through the FIRS e-filing portal at efiling.firs.gov.ng.,,,"filing, return, deadline, March 31, e-filing, annual, online","Nigeria Tax Administration Act 2025, Sections 24–30"
TAX_722,filing,Can tax returns be filed electronically in Nigeria?,"Yes. The FIRS e-filing portal (efiling.firs.gov.ng) supports full electronic submission of CIT, PIT, VAT, and other returns. State IRS offices also have their own electronic filing portals.",,,"filing, return, deadline, March 31, e-filing, annual, online","Nigeria Tax Administration Act 2025, Sections 24–30"
TAX_723,filing,What documentation must accompany a tax return?,"Income statements, pension contribution schedules, NHF and NHIS receipts, audited accounts (for companies), bank statements, capital allowance schedules, and prior year assessment notices.",,,"filing, return, deadline, March 31, e-filing, annual, online","Nigeria Tax Administration Act 2025, Sections 24–30"
TAX_724,filing,What is the process for amending a submitted tax return?,Submit an amended return to the same tax authority with a covering letter explaining the changes. Include corrected figures and supporting documents. Amendments are accepted within 6 years of original filing.,,,"filing, return, deadline, March 31, e-filing, annual, online","Nigeria Tax Administration Act 2025, Sections 24–30"
TAX_725,filing,Who is authorized to file tax returns on behalf of a taxpayer?,"A taxpayer can authorize: a chartered accountant, tax consultant, lawyer, employer (for PAYE), or any other person with a duly executed Power of Attorney or written authority letter.",,,"filing, return, deadline, March 31, e-filing, annual, online","Nigeria Tax Administration Act 2025, Sections 24–30"
TAX_726,filing,How frequently are tax returns required to be filed?,Annually for income tax (PIT and CIT). Monthly for VAT (by 21st of following month). Monthly for PAYE (by 10th of following month). WHT returns are also monthly.,,,"filing, return, deadline, March 31, e-filing, annual, online","Nigeria Tax Administration Act 2025, Sections 24–30"
TAX_727,filing,What compliance standards govern tax filing?,"Filing must comply with the NTA 2025 and Nigeria Tax Administration Act 2025. Returns must be accurate, complete, filed by deadline, and accompanied by required supporting documents.",,,"filing, return, deadline, March 31, e-filing, annual, online","Nigeria Tax Administration Act 2025, Sections 24–30"
TAX_728,compliance,What does tax compliance entail under Nigerian law?,"Tax compliance under NTA 2025 entails: TIN registration, accurate annual filing, timely payment, proper WHT deduction and remittance, 6-year record retention, and cooperation with tax authority.",,,"compliance, records, audit, 6 years, FIRS, obligations, TIN","Nigeria Tax Administration Act 2025, Sections 40–55"
TAX_729,compliance,What obligations must taxpayers fulfill to remain compliant?,"Taxpayers must: obtain TIN, file returns by deadline, pay assessed tax, deduct and remit WHT, keep records for 6 years, respond to audit notices, and report changes in tax-relevant information.",,,"compliance, records, audit, 6 years, FIRS, obligations, TIN","Nigeria Tax Administration Act 2025, Sections 40–55"
TAX_730,compliance,What records are required for tax compliance?,"Required records: all income documents, expense receipts, bank statements, payroll records, asset registers, VAT invoices, WHT deduction schedules, pension statements, and all correspondence with tax authorities.",,,"compliance, records, audit, 6 years, FIRS, obligations, TIN","Nigeria Tax Administration Act 2025, Sections 40–55"
TAX_731,compliance,How long must taxpayers retain financial records?,"The NTA 2025 mandates a minimum 6-year record retention period. For fraud cases, records may be requested beyond 6 years. Electronic records are acceptable if properly maintained and backed up.",,,"compliance, records, audit, 6 years, FIRS, obligations, TIN","Nigeria Tax Administration Act 2025, Sections 40–55"
TAX_732,compliance,What is the scope of a tax audit?,"A tax audit can cover: income tax returns, VAT returns, WHT deductions, PAYE schedules, capital allowances, transfer pricing, related party transactions, and any other tax obligation of the taxpayer.",,,"compliance, records, audit, 6 years, FIRS, obligations, TIN","Nigeria Tax Administration Act 2025, Sections 40–55"
TAX_733,compliance,Under what conditions can a taxpayer be audited?,"A taxpayer can be audited: randomly, upon detection of risk indicators, based on third-party information, following non-filing, when returns appear inconsistent, or during sector-wide compliance exercises.",,,"compliance, records, audit, 6 years, FIRS, obligations, TIN","Nigeria Tax Administration Act 2025, Sections 40–55"
TAX_734,compliance,What triggers a tax audit in Nigeria?,"Triggers include: inconsistent tax returns, lifestyle exceeding declared income, sector compliance reviews, third-party data matching, non-filing, large or unusual transactions, and random audit selection.",,,"compliance, records, audit, 6 years, FIRS, obligations, TIN","Nigeria Tax Administration Act 2025, Sections 40–55"
TAX_735,compliance,What procedures are followed during a tax audit?,"Procedures: advance notice, document request list, document submission by taxpayer, auditor's review, preliminary findings meeting, taxpayer's objection/response, revised findings, and final assessment.",,,"compliance, records, audit, 6 years, FIRS, obligations, TIN","Nigeria Tax Administration Act 2025, Sections 40–55"
